{
  "run_id": "m0-YYYYMMDD-scenario-config",
  "duration_minutes": 30,
  "frame_stats": {
    "total_frames_system": 0,
    "total_frames_mic": 0,
    "total_frames_mixed": 0,
    "dropped_frames_total": 0,
    "dropped_frame_rate_pct": 0.0
  },
  "latency_ms": {
    "p50": 0,
    "p95": 0,
    "max": 0
  },
  "memory_mb": {
    "start_rss": 0,
    "end_rss": 0,
    "growth_30m": 0
  },
  "reliability": {
    "deepgram_disconnects": 0,
    "deepgram_reconnect_attempts": 0,
    "deepgram_reconnect_successes": 0,
    "capture_stalls_gt_5s": 0
  },
  "degradation": {
    "network_drop_tested": false,
    "network_drop_recovered": false,
    "system_capture_unavailable_tested": false,
    "mic_only_fallback_success": false
  },
  "privacy": {
    "raw_audio_files_written": 0
  }
}
