{
  "run_id": "m0-20260312-s4-mixed-soak-30m-cfg-b-batch-2026-03-12t05-15-56-096z",
  "duration_minutes": 0.5,
  "frame_stats": {
    "total_frames_system": 1431,
    "total_frames_mic": 1431,
    "total_frames_mixed": 297,
    "dropped_frames_total": 0,
    "dropped_frame_rate_pct": 0
  },
  "latency_ms": {
    "p50": 459,
    "p95": 832,
    "max": 983
  },
  "memory_mb": {
    "start_rss": 40.66,
    "end_rss": 50,
    "growth_30m": 9.34
  },
  "reliability": {
    "deepgram_disconnects": 0,
    "deepgram_reconnect_attempts": 0,
    "deepgram_reconnect_successes": 0,
    "capture_stalls_gt_5s": 0
  },
  "degradation": {
    "network_drop_tested": false,
    "network_drop_recovered": false,
    "system_capture_unavailable_tested": false,
    "mic_only_fallback_success": false
  },
  "privacy": {
    "raw_audio_files_written": 0
  }
}