{
  "run_id": "m0-20260312-s5-network-drop-cfg-b-batch-2026-03-12t05-15-56-096z",
  "duration_minutes": 0.333,
  "frame_stats": {
    "total_frames_system": 953,
    "total_frames_mic": 953,
    "total_frames_mixed": 198,
    "dropped_frames_total": 0,
    "dropped_frame_rate_pct": 0
  },
  "latency_ms": {
    "p50": 411,
    "p95": 710,
    "max": 994
  },
  "memory_mb": {
    "start_rss": 40.69,
    "end_rss": 47.16,
    "growth_30m": 6.47
  },
  "reliability": {
    "deepgram_disconnects": 1,
    "deepgram_reconnect_attempts": 1,
    "deepgram_reconnect_successes": 1,
    "capture_stalls_gt_5s": 0
  },
  "degradation": {
    "network_drop_tested": true,
    "network_drop_recovered": true,
    "system_capture_unavailable_tested": false,
    "mic_only_fallback_success": false
  },
  "privacy": {
    "raw_audio_files_written": 0
  }
}